{
  "document": "EU Cloud Sovereignty Framework v1.2.1 (Oct. 2025)",
  "version": "1.2.1",
  "seal_levels": [
    {
      "level": 0,
      "label": {
        "en": "No Sovereignty",
        "fr": "FR-TRANSLATION-PENDING"
      },
      "description": {
        "en": "Service, technology or operations under exclusive control of non-EU third parties, governed entirely in non-EU jurisdictions.",
        "fr": "FR-TRANSLATION-PENDING"
      },
      "source_pointer": {
        "document": "EU Cloud Sovereignty Framework v1.2.1 (Oct. 2025)",
        "section": "ECSF §3 SEAL-0",
        "page": 3
      }
    },
    {
      "level": 1,
      "label": {
        "en": "Jurisdictional Sovereignty",
        "fr": "FR-TRANSLATION-PENDING"
      },
      "description": {
        "en": "EU law formally applies with limited practical enforceability; service, technology or operations under exclusive control of non-EU third parties.",
        "fr": "FR-TRANSLATION-PENDING"
      },
      "source_pointer": {
        "document": "EU Cloud Sovereignty Framework v1.2.1 (Oct. 2025)",
        "section": "ECSF §3 SEAL-1",
        "page": 3
      }
    },
    {
      "level": 2,
      "label": {
        "en": "Data Sovereignty",
        "fr": "FR-TRANSLATION-PENDING"
      },
      "description": {
        "en": "EU law applicable and enforceable, with material non-EU dependencies remaining; service, technology or operations under indirect control of non-EU third parties.",
        "fr": "FR-TRANSLATION-PENDING"
      },
      "source_pointer": {
        "document": "EU Cloud Sovereignty Framework v1.2.1 (Oct. 2025)",
        "section": "ECSF §3 SEAL-2",
        "page": 3
      }
    },
    {
      "level": 3,
      "label": {
        "en": "Digital Resilience",
        "fr": "FR-TRANSLATION-PENDING"
      },
      "description": {
        "en": "EU law applicable and enforceable, EU actors exercising meaningful but not full influence; service, technology or operations under marginal control of non-EU third parties.",
        "fr": "FR-TRANSLATION-PENDING"
      },
      "source_pointer": {
        "document": "EU Cloud Sovereignty Framework v1.2.1 (Oct. 2025)",
        "section": "ECSF §3 SEAL-3",
        "page": 3
      }
    },
    {
      "level": 4,
      "label": {
        "en": "Full Digital Sovereignty",
        "fr": "FR-TRANSLATION-PENDING"
      },
      "description": {
        "en": "Technology and operations under complete EU control, subject only to EU law, with no critical non-EU dependencies.",
        "fr": "FR-TRANSLATION-PENDING"
      },
      "source_pointer": {
        "document": "EU Cloud Sovereignty Framework v1.2.1 (Oct. 2025)",
        "section": "ECSF §3 SEAL-4",
        "page": 3
      }
    }
  ],
  "domains": [
    {
      "id": "SOV-1",
      "label": {
        "en": "Strategic Sovereignty",
        "fr": "FR-TRANSLATION-PENDING"
      },
      "description": {
        "en": "Strategic sovereignty captures the degree to which the services of a cloud provider (or technology actor) are anchored within the European Union legal, financial, and industrial ecosystem. It assesses ownership stability, governance influence, and alignment with EU strategic priorities.",
        "fr": "FR-TRANSLATION-PENDING"
      },
      "weight_percent": 15,
      "scope": "assessed",
      "factors": [
        {
          "en": "Ensuring that bodies having decisive authority over your services are located within EU jurisdiction.",
          "fr": "FR-TRANSLATION-PENDING"
        },
        {
          "en": "Evaluating the assurances against change of control.",
          "fr": "FR-TRANSLATION-PENDING"
        },
        {
          "en": "Degree to which the provider relies on financing coming from EU sources.",
          "fr": "FR-TRANSLATION-PENDING"
        },
        {
          "en": "Extent of investment, jobs, and value creation within EU.",
          "fr": "FR-TRANSLATION-PENDING"
        },
        {
          "en": "Involvement in EU initiatives, Consistency with digital, green, and industrial sovereignty objectives defined at EU level.",
          "fr": "FR-TRANSLATION-PENDING"
        },
        {
          "en": "Ability to sustain secure operations against requests to cease or suspend the service, or if vendor support is withdrawn or disrupted.",
          "fr": "FR-TRANSLATION-PENDING"
        }
      ],
      "source_pointer": {
        "document": "EU Cloud Sovereignty Framework v1.2.1 (Oct. 2025)",
        "section": "ECSF §2/§4 SOV-1",
        "page": 2
      }
    },
    {
      "id": "SOV-2",
      "label": {
        "en": "Legal & Jurisdictional Sovereignty",
        "fr": "FR-TRANSLATION-PENDING"
      },
      "description": {
        "en": "Legal & Jurisdictional sovereignty evaluates the legal environment, exposure to foreign authority, and enforceability of rights that govern the services of a technology provider. It determines the extent to which the services are anchored in European jurisdiction and insulated from external legal claims.",
        "fr": "FR-TRANSLATION-PENDING"
      },
      "weight_percent": 10,
      "scope": "assessed",
      "factors": [
        {
          "en": "The national legal system governing the provider's operations and contracts.",
          "fr": "FR-TRANSLATION-PENDING"
        },
        {
          "en": "Degree of exposure to non-EU laws with cross-border reach (e.g., US CLOUD Act, Chinese Cybersecurity Law).",
          "fr": "FR-TRANSLATION-PENDING"
        },
        {
          "en": "Existence of legal, contractual, or technical channels through which non-EU authorities could compel access to data or systems.",
          "fr": "FR-TRANSLATION-PENDING"
        },
        {
          "en": "Applicability of international regimes, which may restrict usage or transfer.",
          "fr": "FR-TRANSLATION-PENDING"
        },
        {
          "en": "Location of intellectual property creation, registration, and development (EU vs. third countries), legal jurisdiction where IP is created and developed.",
          "fr": "FR-TRANSLATION-PENDING"
        }
      ],
      "source_pointer": {
        "document": "EU Cloud Sovereignty Framework v1.2.1 (Oct. 2025)",
        "section": "ECSF §2/§4 SOV-2",
        "page": 2
      }
    },
    {
      "id": "SOV-3",
      "label": {
        "en": "Data & AI Sovereignty",
        "fr": "FR-TRANSLATION-PENDING"
      },
      "description": {
        "en": "Data & AI sovereignty focuses on the protection, control, and independence of data assets and AI services within the EU. It addresses how data is secured, where it is processed, and the degree of autonomy customers retain over AI capabilities.",
        "fr": "FR-TRANSLATION-PENDING"
      },
      "weight_percent": 10,
      "scope": "assessed",
      "factors": [
        {
          "en": "Ensuring that only the customer, not the provider, has effective control over cryptographic access to their data.",
          "fr": "FR-TRANSLATION-PENDING"
        },
        {
          "en": "Visibility into when, where, and by whom data is accessed, including auditability of AI model usage, mechanisms guaranteeing irreversible removal of data, with verifiable evidence.",
          "fr": "FR-TRANSLATION-PENDING"
        },
        {
          "en": "Strict confinement of storage and processing to European jurisdictions, with no fallback to third countries.",
          "fr": "FR-TRANSLATION-PENDING"
        },
        {
          "en": "Extent to which AI models and data pipelines are developed, trained, hosted, and governed under EU control, minimizing dependency on non-EU technology stacks.",
          "fr": "FR-TRANSLATION-PENDING"
        }
      ],
      "source_pointer": {
        "document": "EU Cloud Sovereignty Framework v1.2.1 (Oct. 2025)",
        "section": "ECSF §2/§4 SOV-3",
        "page": 2
      }
    },
    {
      "id": "SOV-4",
      "label": {
        "en": "Operational Sovereignty",
        "fr": "FR-TRANSLATION-PENDING"
      },
      "description": {
        "en": "Operational sovereignty measures the practical ability of EU actors to run, support, and evolve a technology independently of foreign control. It focuses on continuity of operations, skill availability, and resilience against external dependencies.",
        "fr": "FR-TRANSLATION-PENDING"
      },
      "weight_percent": 15,
      "scope": "assessed",
      "factors": [
        {
          "en": "Ease of migrating workloads or integrating with alternative EU-controlled solutions without vendor lock-in.",
          "fr": "FR-TRANSLATION-PENDING"
        },
        {
          "en": "Capacity for EU operators to manage, maintain, and support the technology without requiring non-EU vendor involvement.",
          "fr": "FR-TRANSLATION-PENDING"
        },
        {
          "en": "Existence of an EU-based talent pool with the expertise to operate and sustain the service.",
          "fr": "FR-TRANSLATION-PENDING"
        },
        {
          "en": "Assurance that operational support is delivered from within the EU and subject exclusively to EU legal frameworks.",
          "fr": "FR-TRANSLATION-PENDING"
        },
        {
          "en": "Availability of full technical documentation, source code, and operational know-how enabling long-term autonomy.",
          "fr": "FR-TRANSLATION-PENDING"
        },
        {
          "en": "Location and legal control of critical suppliers or subcontractors involved in service delivery.",
          "fr": "FR-TRANSLATION-PENDING"
        }
      ],
      "source_pointer": {
        "document": "EU Cloud Sovereignty Framework v1.2.1 (Oct. 2025)",
        "section": "ECSF §2/§4 SOV-4",
        "page": 3
      }
    },
    {
      "id": "SOV-5",
      "label": {
        "en": "Supply Chain Sovereignty",
        "fr": "FR-TRANSLATION-PENDING"
      },
      "description": {